Marca,Modello,Descrizione,Immagine,Prezzo,Alimentazione,Cavalli
Fiat,500 Hybrid,Ideale per la citta e dai consumi ridotti.,fiat_500.png,16500,Ibrida,70 CV
Fiat,Panda,La macchina piu amata dagli italiani spaziosa e affidabile.,fiat_panda.png,15000,Benzina,70 CV
Alfa Romeo,Tonale,SUV dal design sportivo e tecnologia di ultima generazione.,alfa_tonale.png,36000,Ibrida,130 CV
Alfa Romeo,Giulia,Berlina sportiva con prestazioni eccezionali e guida pura.,alfa_giulia.png,47000,Diesel,160 CV
Jeep,Avenger,Il nuovo SUV compatto moderno e completamente tecnologico.,jeep_avenger.png,24500,Benzina,100 CV
Jeep,Renegade,Pronta per ogni avventura con assetto rialzato e grande comfort.,jeep_renegade.png,28000,Ibrida,130 CV